Timestamp,Sender,Message
2024-08-12 09:30:10,Samika,Hey, what’s good?
2024-08-12 09:30:45,Friend,Yo! Just woke up, what’s up?
2024-08-12 09:31:20,Samika,Just checking in. Slay all day, right?
2024-08-12 09:31:55,Friend,Haha, always! What’s the plan for today?
2024-08-12 09:32:30,Samika,Not sure yet, just gonna see where the day takes me.
2024-08-12 09:33:05,Friend,That’s valid. Sometimes you gotta go with the flow.
2024-08-12 09:33:40,Samika,For sure. Damn, it’s a nice day out.
2024-08-12 09:34:15,Friend,Yeah, we should do something outside.
2024-08-12 09:34:50,Samika,Yo, maybe a hike? You down?
2024-08-12 09:35:25,Friend,Brooo, I’m so down. Let’s go.
2024-08-12 09:36:00,Samika,Slay. Meet you in an hour?
2024-08-12 09:36:35,Friend,Bet. See you then.
2024-08-12 10:45:00,Samika,Yo, ready to slay this hike?
2024-08-12 10:45:35,Friend,Always! Let’s do it.
2024-08-12 10:46:10,Samika,This trail is legit, right?
2024-08-12 10:46:45,Friend,No way, it’s perfect. Great choice.
2024-08-12 10:47:20,Samika,Thanks, I knew you’d like it.
2024-08-12 10:47:55,Friend,Makes sense, makes sense. You always pick the best spots.
2024-08-12 10:48:30,Samika,Slay queen gotta do what she gotta do.
2024-08-12 10:49:05,Friend,Lmfao, you’re too much.
2024-08-12 10:49:40,Samika,Just keeping it real, you know?
2024-08-12 10:50:15,Friend,That’s valid. This hike is slaying me though.
2024-08-12 10:50:50,Samika,Haha, we got this. Ggs all the way.
2024-08-12 10:51:25,Friend,Yo, I’m feeling the burn.
2024-08-12 10:52:00,Samika,Damn, same. But it’s worth it.
2024-08-12 10:52:35,Friend,Absolutely. Slay for the gains.
2024-08-12 10:53:10,Samika,Lmfao, slay for life.
2024-08-12 10:53:45,Friend,You know it!
2024-08-12 10:54:20,Samika,We’re almost there, keep pushing.
2024-08-12 10:54:55,Friend,Yo, I’m on it. Let’s finish strong.
2024-08-12 10:55:30,Samika,Slay all day, we got this.
2024-08-12 10:56:05,Friend,Done! Ggs, we did it.
2024-08-12 10:56:40,Samika,Damn, that was a good one.
2024-08-12 10:57:15,Friend,For real, we should do this more often.
2024-08-12 10:57:50,Samika,I’m down whenever. Just hit me up.
2024-08-12 10:58:25,Friend,Will do! Later, slay queen.
2024-08-12 10:59:00,Samika,Later, ggs!
